{"apiVersion":"herdforge.dev/v1alpha1","callbackDestination":"herdforge-coordinator","correlation":{"callbackSequence":7,"candidateSha":"3333333333333333333333333333333333333333","phaseId":"phase-SPE-566-implement","runId":"run-SPE-566-1","scopeId":"scope-SPE-566","task":"SPE-566"},"evidence":[{"digest":"sha256:4444444444444444444444444444444444444444444444444444444444444444","kind":"test"}],"idempotencyKey":"idem-SPE-558-1","job":{"candidateSha":"3333333333333333333333333333333333333333","effectiveModel":"gpt-5.6-luna","provider":"openai"},"kind":"TrustedJobCallback","scope":{"apiVersion":"herdforge.dev/v1alpha1","kind":"AgentScope","metadata":{"expiresAt":"2026-08-03T13:00:00Z","id":"scope-SPE-566","issuedAt":"2026-08-03T12:00:00Z","phaseId":"phase-SPE-566-implement","runId":"run-SPE-566-1","task":"SPE-566"},"spec":{"commandProfiles":["git-commit","go-test"],"credentials":[{"expiresAt":"2026-08-03T12:45:00Z","provider":"openai","ref":"pi-openai-SPE-566","scopes":["inference"]}],"evidence":{"kinds":["diff","lint","receipt","test"],"maxBytes":1048576,"prefix":".herd/evidence/SPE-566"},"git":{"actions":["add","commit","create_pr","diff","push","status"]},"grants":{"extensions":[],"kubernetes":false,"unrestrictedShell":false},"network":{"allowedHosts":["api.openai.com"],"mode":"allowlist"},"paths":{"readable":["contracts/agentscope/v1alpha1","go.mod","pkg/agentscope"],"writable":["contracts/agentscope/v1alpha1","pkg/agentscope"]},"repository":{"baseSha":"1111111111111111111111111111111111111111","headSha":"2222222222222222222222222222222222222222","identity":"github.com/Kampe/Herdforge"},"runtime":{"deadlineSeconds":1800,"loopRepeatThreshold":3,"loopWindow":12,"maxPaidUsd":8,"maxTokens":120000,"maxTurns":24,"model":"gpt-5.6-luna","provider":"openai","stallTimeoutSeconds":180},"subject":{"agentId":"pi-worker-1","lane":"foundation","sessionId":"session-SPE-566-1"},"worktree":{"identity":"worktree-SPE-566","mutable":true,"path":".worktrees/SPE-566-agentscope-contract","repositoryRoot":".","shared":false}}},"scopeDigest":"sha256:4ede6bb11f103f38c8565c487d136b7b240e82bd1484f8e5f0efda6f246f758f","submissionDigest":"sha256:1afd81140222babfc494ca6e71b557b3056372e60a91353eaa37337ea8d0f319"}
